	text	label
245	did not prevent President Lincoln from promulgating in April, a code of rules to govern the conduct in the field of the armies of the United States which was prepared at his instance by a commission headed by Francis Lieber and which later became the basis of all similar codifications both here and abroad.	0
1052	PRESIDENTIAL DIPLOMATIC AGENTS What the President may have lost in consequence of the intervention of Congress in this field, he has made good through his early conceded right to employ, in the discharge of his diplomatic function, so called special, personal, or secret agents without consulting the Senate.	0
832	It has been said, for instance, in this connection, that a carrier is a servant; while nothing can be clearer than that, while goods are in custody, they are in his possession.	1
1456	This was the first instance of a master being made unconditionally liable for the wrongs of his servant.	1
16	When a suspect speaks because he is overborne, it is immaterial whether he has been subjected to a physical or a mental ordeal.	1
469	Conversely, the President is not obliged by this clause to impart information which, in his judgment, should in the public interest be withheld.	0
324	Again, the real substance of the defence is not that the damage was not intended, that would be no defence at all; but that, whether it was intended or not, that is, even if the defendant foresaw it and foresaw it with pleasure, the manifest facts and circumstances under which he said it were such that the law considered the damage to the plaintiff of less importance than the benefit of free speaking.	1
1147	The anomalous distinction according to which, if the servant receives the thing from another person for his master, the servant has the possession, and so cannot commit theft, is made more rational by the old cases.	1
1385	The Transmitter concentrates his thought and Will in the usual manner, while the Receiver places himself in the usual receptive, passive state of mind, and awaits the impressions.	0
1081	She reigns therefore, most unquestionably, by a divine right, as every mother is, or ought to be, a queen in her own family.	0
663	If the bee keeper wishes to see their innate capabilities fully developed, let him rear a lot for himself among some old combs, and if prizes were offered for fat and full grown worms, he might easily obtain one.	1
530	Furthermore, as formerly the defendant's public calling had the same effect as an assumpsit for the purpose of charging him in tort, it seems now to have been thought an equally good substitute for a special promise, in order to charge him in assumpsit.	1
991	Not one of them offers any remedy for the loss of the queen, or indeed for most of the casualties to which bees are exposed: they form no reliable basis for any new system of management; and hence the cultivation of bees, is substantially where it was, fifty years ago, and the Apiarian as entirely dependent as ever, upon all the whims and caprices of an insect which may be made completely subject to his control.	0
553	Health is probably a woman's greatest capital, and a Girl Scout looks after it and saves it, and doesn't waste it by poor diet and lack of exercise and fresh air, so that she goes bankrupt before she is thirty.	0
728	If, on the contrary, the queen bee had been compelled, solitary and alone, to lay the foundations of a new commonwealth, the honey harvest would have disappeared before she could have become the parent of a numerous family.	0
250	and the observations of Sohm in his treatise on the Procedure of the Salic Law, Sections French Tr.	1
797	In the protest formal objection is made against the breaking of the promise, and demanding that the matter be set right by the maker, or on his failure, by the indorser.	1
586	Huon starts upon the task, leaving twelve of his knights as hostages.	0
435	But such has not been the fact.	0
1284	The Orientals call the honey bee, Deburrah, She that speaketh.	1
263	A different theory is offered by Justice Story in his opinion for the Court in Prigg v. Pennsylvania, Pet.	0
1551	Where the gravity of the crime and other factors such as the age and education of the defendant, the conduct of the court or the prosecuting officials, and the complicated nature of the offense charged and the possible defenses thereto render criminal proceedings without counsel so apt to result in injustice as to be fundamentally unfair, the latter group majority holds that the accused must have legal assistance under the amendment whether he pleads guilty or elects to stand trial, whether he requests counsel or not.	1
1555	While regretting that the trial court has not had the testimony read or repeated to the accused, the Supreme Court held that a deaf person is not deprived of due process of law because he had not heard a word of the evidence.	1
513	Find a good honest lawyer, despite sneers to the contrary, we believe most men in the profession are of this character, and ask his advice, and pay for his help if papers are to be drawn.	0
999	Now, I said, if you will take the trouble to move that wood pile you will find in it the remains of the rabbit half devoured and the mink himself.	0
1090	So long as such arrests are made in good faith and in the honest belief that they are needed in order to head the insurrection off, the Governor is the final judge and cannot be subjected to an action after he is out of office on the ground that he had not reasonable ground for his belief.	0
526	Friendliness: The disposition to make everyone you meet feel at ease, and to be of service to him if possible.	1
996	Not until Boyd v. United States did it have to meet the issue; there, pursuant to an act of Congress, a court had issued an order in a proceeding for the forfeiture of goods for fraudulent nonpayment of customs duties, requiring the claimant to produce in court his invoices covering the goods, on pain of having the allegation taken as confessed against him.	0
516	FOOTNOTES: The author of this work regrets that his experience does not enable him to speak with such absolute confidence as to the character of all the bee keepers whom he has known.	0
816	Instances wherein the President has felt and fulfilled such a duty have not been rare in our history, though, being for the public benefit and approved by all, his acts have seldom been challenged in the courts.	0
1537	When the object is not too far down the throat it may be necessary for someone to use his fingers to pull out the offending substance to keep the patient alive until the doctor can arrive.	1
143	In a dictum in Ex parte Grossman, Chief Justice Taft, while holding for the Court on the main issue that the President may pardon a criminal contempt, declared that he may not pardon a civil contempt.	0
402	Before starting to prepare a meal the Scout should not only have her menu in mind, but should have an idea how long it will take to prepare each dish so that everything will be ready to serve at the same time with all the hot dishes very hot and all the cold dishes very cold.	1
300	A small hole, about as large as a thimble, may be gouged out of a block, and covered over with wire gauze, or any other kind of perforated cover, so that when the queen is put in, the bees cannot enter to destroy her.	0
476	Directly the instructor sees a scout, he directs him to stand up as having failed.	0
62	See in this connection the cases cited by Justice Sutherland in his opinion for the Court in Phillips Petroleum Co. v. Jenkins, U.S. .	0
696	If the story was believed, it would be conclusive against the defendant's negligence judged by a moral standard which would take his personal characteristics into account.	1
1507	WEEDING OUT Every man in trade should make an inventory of his stock at least once a year.	0
1353	The sailor can then grasp either one as he goes about and there is no danger of losing the paddles overboard.	0
665	If the case should only be, that he MIGHT lay it down, unless continued by a new choice, and if he should be desirous of being continued, his wishes, conspiring with his fears, would tend still more powerfully to corrupt his integrity, or debase his fortitude.	0
632	If every Girl Scout in America realized that she might make all the difference, some day, between a bankrupt family and a family with a comfortable margin laid aside for a rainy day, she would give a great deal of attention to this Scout law.	0
1242	The judge must banish the slightest personal impulse to reprisal, but he should not bend backward and injure the authority of the court by too great leniency.	0
182	Similarly, in a suit against a local partnership, in which the resident partner was duly served with process and the nonresident partner was served only with notice, a judgment thus obtained is binding upon the firm and the resident partner, but is not a personal judgment against the nonresident and cannot be enforced by execution against his individual property.	0
1431	They may act on the statement of a special jury, as in the time of Lord Mansfield and his successors, or upon the finding of a common jury based on the testimony of witnesses, as is the practice to day in this country.	1
214	By a similar process of reasoning, in Solesbee v. Balkcom, the Court sustained a Georgia statutory procedure granting the governor discretionary authority, with the aid of physicians appointed by himself, to determine, without opportunity for an adversary hearing or for judicial review, whether a condemned convict has become insane and, if so, whether he should be committed to an insane asylum.	0
863	It is, says the analytical jurist, because, although he was not negligent at the moment of escape, he was guilty of remote heedlessness, or negligence, or fault, in having such a creature at all.	0
1495	Until Reagan v. Farmers' Loan and Trust Company the Court maintained a distinction between the duty imposed upon an official by the general laws of the State and the duty imposed by a specific unconstitutional statute and held that whereas an injunction would not lie to restrain a State official from enforcing an act alleged to be unconstitutional in pursuance of the general duties of his office, it would lie to restrain him from performing special duties vested in him by an unconstitutional statute.	1
1011	On the contrary, the seven Justices maintained that although a State legislature may prescribe a form of procedure to be observed in the taking of private property for public use, it is not due process of law if provision be not made for compensation The mere form of the proceeding instituted against the owner, , cannot convert the process used into due process of law, if the necessary result be to deprive him of his property without compensation.	1
791	In the general course of human nature, a power over a man's subsistence amounts to a power over his will.	1
60	The Dartmouth College Case The third view is the one formulated by Chief Justice Marshall in his controlling opinion in Trustees of Dartmouth College v. Woodward.	0
615	If a President shall not have been chosen before the time fixed for the beginning of his term, or if the President elect shall have failed to qualify, then the Vice President elect shall act as President until a President shall have qualified; and the Congress may by law provide for the case wherein neither a President elect nor a Vice President elect shall have qualified, declaring who shall then act as President, or the manner in which one who is to act shall be selected, and such person shall act accordingly until a President or Vice President shall have qualified.	1
374	As an old queen never leaves the hive except to accompany a new swarm, the loss of her wings does not, in the least interfere with her usefulness, or with the attachment of the bees.	1
652	If possible, the rescuer should insulate himself by covering his hands with a mackintosh, rubber sheeting, several thicknesses of silk, or even dry cloth.	1
1103	Some day you will read the life story of David Glasgow Farragut of whom it is said that, with the exception of Nelson, the great English admiral, he was as great an admiral as ever sailed the broad or narrow seas.	0
1250	The law may, therefore, throw on the actor the peril, not only of the consequences foreseen by him, but also of consequences which, although not predicted by common experience, the legislator apprehends.	0
252	A baker's man, while driving his master's cart to deliver hot rolls of a morning, runs another man down.	0
1279	The only advantage the performer gained by resorting to these unfair methods was that it was less fatiguing to his mind and enabled him to fake through the performance with less mental wear and tear.	1
199	That record included only the indictment, the judgment on the plea of guilty to a charge of murder, the minute entry bearing on the sentence, and the sentence, together with a lengthy recital in the judgment to the effect that when the defendant expressed a desire to plead guilty the Court explained to him the consequence of such plea, his rights in the premises, especially, his rights to have a lawyer appointed to defend him and to be tried before a jury, and the degree of proof required for an acquittal under a not guilty plea, but that the defendant persisted in his plea of guilty.	0
439	But the philosophical analysis of every wrong begins by determining what the defendant has actually chosen, that is to say, what his voluntary act or conduct has been, and what consequences he has actually contemplated as flowing from them, and then goes on to determine what dangers attended either the conduct under the known circumstances, or its contemplated consequence under the contemplated circumstances.	1
1161	The Book of King Arthur and His Noble Knights Mary MacLeod Fred'k A. Stokes The Boys Gughulain Eleanor Hull Crowell Co.	0
1285	The original limitation of liability to surrender, when the owner was before the court, could not be accounted for if it was his liability, and not that of his property, which was in question.	0
681	If the hunter fails to find all the rabbits, he scores twenty five for each one he gives up.	1
34	When State action is attacked under the due process clause, the assailant usually charges also that he is denied the equal protection of the laws.	1
942	Many of the provisions thus activated delegate powers of greater or less importance to the President himself or remove statutory restrictions thereon.	0
544	Having acquired a knowledge of their habits, not a bee will buzz in his ear, without recalling to him some of these lessons, and helping to make him a wiser and a better man.	0
5	If a man holds land of the Crown by fee farm', socage', or burgage', and also holds land of someone else for knight's service, we will not have guardianship of his heir, nor of the land that belongs to the other person's fee', by virtue of the fee farm', socage', or burgage', unless the fee farm' owes knight's service.	0
989	Nor was any attention given the fact that Lincoln had asked Congress to ratify and confirm his acts, which Congress promptly did, with the exception of his suspension of the habeas corpus privilege which was regarded by many as attributable to the President in the situation then existing, by virtue of his duty to take care that the laws be faithfully executed.	0
1073	Savigny very nearly expressed the truth when he said, somewhat broadly, that every accessio, for whatever purpose, presupposes nothing else than a relation of juridical succession between the previous and present possessor.	0
78	PROCEDURE FOR REMOVAL Only after a person has been charged with crime in the regular course of judicial proceedings is the governor of a State entitled to make demand for his return from another State.	1
365	Another way to remind himself is to wear his scout badge reversed until he has done his good turn.	0
835	It has often been said that malice is one of the elements of liability, and the doctrine is commonly stated in this way: that malice must exist, but that it is presumed by law from the mere speaking of the words; that again you may rebut this presumption of malice by showing that the words were spoken under circumstances which made the communication privileged, as, for instance, by a lawyer in the necessary course of his argument, or by a person answering in good faith to inquiries as to the character of a former servant, and then, it is said, the plaintiff may meet this defence in some cases by showing that the words were spoken with actual malice.	1
1038	Or was it begun from the apprehension that she might again be removed?	0
552	He wrote: I am aware of course that the word intent as vaguely used in ordinary legal discussion means no more than knowledge at the time of the act that the consequences said to be intended will ensue.	0
1045	Pending his arrival the scout should remember to treat the sufferer for shock as well as to dress the wound.	1
1127	Suppose that a defendant were allowed to testify that, before acting, he considered carefully what would be the conduct of a prudent man under the circumstances, and, having formed the best judgment he could, acted accordingly.	1
28	But, as shown above, a naturalized citizen is subject at any time to have his good faith in taking the oath of allegiance to the United States inquired into, and to lose his citizenship if lack of such faith is shown in proper proceedings.	1
359	And so we Scouts, not to lose this great spirit, study the stars and the sun and the trees and try to learn a few of the wood secrets she knew so well.	0
189	Justice Black, concurring in this view, added the caveat that the taxing rights of other States should not be foreclosed and made reference to his leave it to Congress notion.	0
1032	'One wraps himself in a woolen blanket to keep warm to keep the heat in.	0
1464	Thus showing that the vendor changed possession by holding in the name of the purchaser, as his agent to possess.	0
1417	There were writs of debt and of covenant; there were writs of trespass for forcible injuries to the plaintiff's person, or to property in his possession, and so on.	0
430	But no one has any idea how cross, crooked, and contrary a creature can be, until he wishes it to repeat for him some ordinary things that it has hitherto done hourly.	1
1518	When a judge rules that there is no evidence of negligence, he does something more than is embraced in an ordinary ruling that there is no evidence of a fact.	1
745	In detinue the plea was that the plaintiff delivered the defendant a chest locked with his key, that the chattels were in the chest, and that they were taken from the defendant together with his own goods by robbery.	1
693	If the seller is introduced by the name B, and the buyer supposes him to be another person of the same name, and under that impression delivers his written promise to buy of B, the B to whom the writing is delivered is the contractee, if any one is, and, notwithstanding what has been said of the use of proper names, I should suppose a contract would be made.	0
175	However, there must be something more than an ordinary honest mistake of law in the proceedings for compensation before a party can make out that the State has deprived him of his property unconstitutionally.	1
881	It was a proceeding to recover those compositions, at first optional, afterwards compulsory, by which a wrong doer bought the spear from his side.	1
1445	This mark must be simple and legible and was chosen because of something connected with the owner or his family.	0
1375	The Supreme Court has said that the constitutional guarantee of liberty 'embraces not only the right of a person to be free from physical restraint, but the right to be free in the enjoyment of all his faculties .'	1
117	To recur to the case of rights acquired by prescription, every universal successor could add the time of his predecessor's adverse use to his own in order to make out the right.	1
1415	There may have been some hesitation as to robbery when the robber was unknown, and so the bailee had no remedy over, or even as to robbery generally, on the ground that by reason of the felony the bailee could not go against either the robber's body or his estate; for the one was hanged and the other forfeited.	1
86	However, mandamus proceedings to compel a State official to perform a plain or ministerial duty which admits of no discretion are not suits against the State since the official is regarded as acting in his individual capacity in failing to act according to law.	1
248	while the court ruled with regard to the defendant's conduct as has been mentioned, it held that whether the plaintiff was guilty of contributory negligence in not having vaccinated his children was a question of fact, and was properly left to the jury.	1
180	MODIFICATION OF TARIFF LAWS This point was raised again in Field v. Clark, where the Tariff Act of was assailed as unconstitutional because it directed the President to suspend the free importation of enumerated commodities for such time as he shall deem just if he found that other countries imposed upon agricultural or other products of the United States duties or other exactions which he may deem to be reciprocally unequal and unjust.	0
1559	With a little practice in observation you can tell pretty accurately a man's character from his dress.	0
115	Papers already in the custody of a United States court in consequence of their having been used by the owner himself as evidence on another proceeding may be used before a grand jury as a basis for an indictment for perjury.	0
351	An intelligent Mandingo African informed a lady of my acquaintance, that they do not in his country, dare to eat unsealed honey, until it is first boiled.	0
98	Thus spoke the former President Taft, and the result of his prepossession was a rule which, as was immediately pointed out, exposed the so called independent agencies, the Interstate Commerce Commission, the Federal Trade Commission, and the like, to Presidential domination.	0
914	Kneel astride of the patient facing toward his head.	0
1278	The one had culture, wealth, and social position; the other lacked all of these in his early years.	1
44	An accused does not, however, have a legal right to a jury composed in whole or in part of members of his own race.	1
1493	Unless the badge is to be presented to the Captain herself, her recommendation is required.	0
855	It is said that a curia claudenda only lay upon a prescriptive right, and that if the duty to fence was by indenture the plaintiff was put to his writ of covenant.	1
1460	Those cases which attribute possession to a transferee of goods in the hands of a middleman, without distinguishing whether the middleman holds in his own name or the buyer's, are generally right in the result, no doubt, but have added to the confusion of thought upon the subject.	0
193	Pleas in Abatement. State legislation which forbids a defendant to come into court and challenge the validity of service upon him in a personal action without thereby surrendering himself to the jurisdiction of the Court, but which does not restrain him from protecting his substantive rights against enforcement of a judgment rendered without service of process, is constitutional and does not deprive him of property without due process of law.	1
499	'Even interstate business must pay its way,' and the bare fact that one is carrying on interstate commerce does not relieve him from many forms of State taxation which add to the cost of his business.	1
786	In the exercise of its discretion, it may issue a warrant for the arrest of a witness to procure his testimony, without previous subpoena, if there is good reason to believe that otherwise such witness would not be forthcoming.	1
1072	Said he: The King of England before our Revolution, in the exercise of his prerogative, had always exercised the power to pardon contempts of court, just as he did ordinary crimes and misdemeanors and as he has done to the present day.	0
685	If the liability of a master for the torts of his servant had hitherto been recognized by the courts as the decaying remnant of an obsolete institution, it would not be surprising to find it confined to the cases settled by ancient precedent.	1
607	If a depositor withdraws his money before the day when interest is due, he forfeits the interest.	1
1298	The performance of that condition is purely optional until one side has brought it within the scope of the other's undertaking by performing it himself.	1
122	ADMINISTRATIVE DECENTRALIZATION VERSUS JACKSONIAN CENTRALISM An opinion rendered by Attorney General Wirt in asserted the proposition that the President's duty under the take care clause required of him scarcely more than that he should bring a criminally negligent official to book for his derelictions, either by removing him or by setting in motion against him the processes of impeachment or of criminal prosecution.	0
928	Letter of Attorney General McReynolds to the Secretary to the President, dated August stating that it would be incompatible with the public interest to send to the Senate in response to its resolution, reports made to the Attorney General by his associates regarding violations of law by the Standard Oil Co. Letter of Attorney General Gregory to the President of the Senate, dated February declining to comply with a resolution of the Senate requesting the Attorney General to report to the Senate his findings and conclusions in the investigation of the smelting industry.	0
1565	Wounds With Severe Bleeding A scout must be prepared to check severe bleeding at once, and he should then dress the wound.	1
523	for the Roman Caesar upon his lips.	0
1083	Should shame man for his neglect of ventilation.	0
