	text	label
954	Moreover, for a long time after Henry II., whenever an action was brought for a debt of which there was no written evidence, the plaintiff, when asked what he had to show for it, always answered good suit, and tendered his witnesses, who were sometimes examined by the court.	0
560	Here it plainly appears that the buyer knows exactly what he is going to get, and therefore that the mistake of color has no bearing on the bargain.	1
1181	The contestant can at any time end the bout by lowering his head so the strap slips off; but this counts one against him.	1
1243	The king of Great Britain, on his part, has an absolute negative upon the acts of the two houses of Parliament.	0
1016	On the supposition that by the time the fruit trees are in blossom, the Apiarian has, in hives of my construction, ten powerful colonies, let him select four of the strongest, and make from each a forced swarm.	1
1200	The Eaglet returns the salute and then marches to her position in line.	0
1553	Whether A insists on the condition or not, he is not bound to do any more.	0
36	A statute providing that no person shall be denied opportunity for employment because he is not a member of a union does not offend the equal protection clause.	1
759	In his dissenting opinion in New State Ice Co. v. Liebmann, U.S. , Justice Brandeis had also observed that: The notion of a distinct category of business 'affected with a public interest' employing property 'devoted to a public use' rests upon historical error.	0
19	All fines that have been given to us unjustly and against the law of the land, and all fines that we have exacted unjustly, shall be entirely remitted or the matter decided by a majority judgement of the twenty five barons referred to below in the clause for securing the peace together with Stephen, archbishop of Canterbury, if he can be present, and such others as he wishes to bring with him.	0
195	As a basis for distinguishing these last two decisions the Court observed that while the decisions are manifold that within the limits of fairness and reason the burden of proof may be shifted to the defendant even in criminal prosecutions, nevertheless, to be justified, the evidence held to be inculpatory must have had at least a sinister significance , or if this at times be lacking, there must be in any event a manifest disparity in convenience of proof and opportunity for knowledge, Whereas, accordingly, under the terms of the section previously upheld, the defendant could prove his citizenship without trouble, and the State, if forced to disprove his claim, could be relatively helpless, the background of the accused party being known probably only to himself and close relatives, the alleged Japanese defendant, in the last mentioned case, would have suffered hardship and injustice if compelled to prove non Japanese origin, especially since ineligibility renders criminal conduct otherwise lacking in sinister significance occupation of land under lease from an American codefendant .	0
1497	Very often, however, a person in bed is quite able to bathe herself, with a little help, if the necessary things are brought to her.	0
876	It should be noted, however, that if the President fails to act, or if he adopts a narrow construction of a statute which he dislikes, and on this ground professes inability to act, the only remedy available against him is impeachment.	1
822	It also appears that the plaintiff was trying to stand on two grounds; first, privity, as descendant and assign of the covenantee; second, that the service was attached to the manor by covenant or by prescription, and that he could maintain covenant as tenant of the manor, from whichever source the duty arose.	1
12	But those extravagances , do not justify penalizing the speaker by depriving him of the platform or by punishing him for his conduct.	1
11	The women of Oregon have raised a statue to this young explorer, and there she stands in Portland, facing the Coast, pointing to the Columbia River where it reaches the sea.	0
1300	The person of the king of Great Britain is sacred and inviolable; there is no constitutional tribunal to which he is amenable; no punishment to which he can be subjected without involving the crisis of a national revolution.	0
227	Letter and facts from The Encyclopedia Americana. Battle Hymn of the Republic Mine eyes have seen the glory of the coming of the Lord: He is trampling out the vintage where the grapes of wrath are stored; He hath loosed the fateful lightning of His terrible swift sword; His truth is marching on.	1
930	Liability is said to arise out of such conduct as would be blameworthy in him.	0
880	It should enable the Apiarian, when he has removed the combs from a common hive, to place them with the bees, brood, honey and bee bread, in the improved hive, so that the bees may be able to attach them in their natural positions.	1
511	Experience has shown that she hesitates to break it.	1
1123	Such is the passion of bees for storing away honey, that large supplies of it will always most seriously interfere with breeding, unless the bees are sufficiently numerous to build new comb in which the queen can find room for her eggs.	0
802	In the supposed case of an auctioneer, for instance, if he had paid the true owner, it would have been an answer to his bailor's claim.	1
1387	The Transmitter, with closed eyes, now took his position immediately back of Mr Smith, but at a distance of two feet from him, no contact being allowed, this precaution being taken to obviate charges of confederacy, etc.	0
661	If the archbishop cannot be present, proceedings shall continue without him, provided that if any of the twenty five barons has been involved in a similar suit himself, his judgement shall be set aside, and someone else chosen and sworn in his place, as a substitute for the single occasion, by the rest of the twenty five.	0
569	How little Lord Holt meant to adopt the modern view, that delivery, being a detriment to the owner, was a consideration, may be further seen by examining the cases put and agreed to by him from the Year Books.	1
1526	When anyone falls through some ice, throw him your Staff so that he can grasp it like this until you can get a rope and pull him out.	1
186	Moreover, even when the cause of action arose in the forum State and suit was instituted by a corporation chartered therein, a foreign company retailing clothing in Oklahoma was held immune from service of process on its president when the latter visited New York on one of his periodic trips there for the purchase of merchandise.	0
982	No one was allowed to leave the room after the object had been fixed upon; no communication with the child was conceivable, as her place was often changed.	0
94	GAINS IN THE FORM OF REAL ESTATE; WHEN TAXABLE AS INCOME When through forfeiture of a lease in a landlord became possessed of a new building erected on his land by the outgoing tenant, the resulting gain to the former was taxable to him in that year.	1
1003	Of course one must have cultivated a great degree of sensitiveness to mental impressions before he will be able to receive and respond to the direction impressions in this case.	1
48	In exercising the power granted by section to judge the qualifications of its own members, each House has asserted the power to inquire into the conduct of a member elect prior to his election.	1
1392	The unskilled farmer can never succeed largely, no matter how hard he works.	1
568	How does every fact in the history of the bee, when properly investigated, point with unerring certainty to the power, wisdom and goodness, of Him who made it	0
648	If one does, then the keeper can tag him unless he reaches the firing line , and send him to do duty as keeper at the rock.	1
1363	The Senate may suggest conditions and limitations to the President, but it cannot vary those submitted by him, for no appointment can be made except on his nomination, agreed to without qualification or alteration.	1
1579	Research in psychology has shown that increased pressure is potentially harmful to people's capacity to exhibit their 'true' capability	0
1107	Soon afterwards they ceased to build, and appeared dispirited; and when, in the beginning of June, he examined the colony again, he found plenty of drone brood in worker cells	0
757	In Graves v. Elliott, decided in the same year, the Court upheld the power of New York, in computing its estate tax, to include in the gross estate of a domiciled decedent the value of a trust of bonds managed in Colorado by a Colorado trust company and already taxed on its transfer by Colorado, which trust the decedent had established while in Colorado and concerning which he had never exercised any of his reserved powers of revocation or change of beneficiaries.	0
1069	Runaway Horses The method for checking a horse running away is not to run out and wave your arm in front of him, as this will only cause him to dodge to one side and to run faster, but to try to run alongside the vehicle with one hand on the shaft to prevent yourself from falling, seizing the reins with the other hand and dragging the horse's head toward you.	1
1338	The question is, why, if one man is not presumed to intend to pay money until he has money's worth, the other is presumed to intend to give money's worth before he has money.	0
1158	The bees, as soon as they miss their queen, will rise into the air, and by placing her on the twig of a tree, they will soon cluster around her in the manner already described.	0
1150	The answer to this question has been anticipated in the investigation of its other characteristics, and is satisfactorily deducible from these circumstances; from the election of the President once in four years by persons immediately chosen by the people for that purpose; and from his being at all times liable to impeachment, trial, dismission from office, incapacity to serve in any other, and to forfeiture of life and estate by subsequent prosecution in the common course of law.	1
323	Again, it might well seem that to enter a man's house for the purpose of carrying a present, or inquiring after his health when he was ill, was a harmless and rather praiseworthy act, although crossing the owner's boundary was intentional.	0
640	If in the insect, Season's twilight ray Sheds on the darkling mind a doubtful day, Plain is the steady light her Instincts yield, To point the road o'er life's unvaried field; If few these instincts, to the destined goal, With surer coarse, their straiten'd currents roll.	0
81	Similarly, measures authorizing the President to reorganize executive agencies have provided that a Reorganization Plan promulgated by him should be reported by Congress and should not become effective if one or both Houses adopted a resolution disapproving it.	1
1289	The party to whom orders are transferred must go through the same forms at the office, where payment is made, as if he was the original payee.	1
919	Labor Saving The housekeeper must learn how to do her work in the least possible time; she must save steps.	1
536	Hard spurring is just so much more likely to lead to harm than merely riding a horse in the street, that the court thought that the defendant would be bound to look out for the consequences of the one, while it would not hold him liable for those resulting merely from the other; because the possibility of being run away with when riding quietly, though familiar, is comparatively slight.	1
427	But it was answered that the defendant committed a wrongful act when he surcharged the boat, and the objection was overruled.	0
1552	Wherever consideration was mentioned, it was always as quid pro quo, as what the contractor was to have for his contract.	0
1266	The meaning seems equally clear when we say that a free servant, in his relations as such, is in many respects likened by the law to a slave not, of course, to his own detriment as a freeman .	1
32	An owner aggrieved by discrimination is entitled to have his assessment reduced to the common level.	1
76	But a defendant cannot be extradited if he was only constructively present in the demanding State at the time of the commission of the crime charged.	1
590	I do not know that I can better illustrate the importance of the inexperienced Apiarian following carefully my directions, than by supposing him to return the queen to the colony to which she does not belong.	0
799	In the same way the Apiarian can easily strengthen all his colonies which are feeble in Spring.	1
990	Nor would it matter that the thief afterwards changed his mind and returned the goods.	0
573	HOW THE PRESIDENT'S OWN POWERS ARE EXERCISED Whereas the British monarch is constitutionally under the necessity of acting always through agents if his acts are to receive legal recognition, the President is presumed to exercise certain of his constitutional powers personally.	0
819	Invoking the supremacy clause, the Supreme Court held that a person could not be guilty of a crime under State law for doing what it was his duty to do as an officer of the United States.	1
474	Did you ever watch sticklebacks build their barrel like nest, or the Paradise fish his floating nest, and the father fish take all the care of the young?	0
1119	Such a gentleman, he said, I have in mind.	0
882	It was alleged that the defendant performed his cure so negligently that the horse died.	0
892	It will be a good thing for a scout always to carry a Red Cross First Aid Outfit, or some similar outfit, for with this he is ready to take care of almost any injury; without it he will find it very difficult to improvise anything to cover a wound with safety to the injured person.	1
1473	Thus, suits brought against State officials acting either in excess of their statutory authority or in pursuance of an unconstitutional statute are suits against the officer in his individual capacity and therefore are not prohibited by the Eleventh Amendment; and suits against an officer for the commission of a common law tort alleged to be justified by a statute or administrative order of the State belong to the same category.	0
1455	This was an action against the master of a ship lying in the river Thames, for the loss of goods intrusted to him.	0
270	A good hive should enable the Apiarian, if he relies on natural swarming, and wishes to multiply his colonies as fast as possible, to make vigorous stocks of all his small after swarms.	0
154	A witness may not refuse to answer questions on the ground that he would thereby expose himself to prosecution by a state.	1
1036	Only when the accused refuses counsel with an understanding of his rights can the Court dispense with counsel.	1
564	Hitherto philosophers have claimed our admiration of nature for her care in preserving and multiplying the species.	1
1118	Substitution for a presentment or indictment by a grand jury of the proceeding by information, after examination and commitment by a magistrate, certifying to the probable guilt of the defendant, with the right on his part to the aid of counsel, and to the cross examination of the witnesses produced for the prosecution is due process of law.	1
682	If the hunter has to leave the circle he gets one point for every step he takes outside.	1
108	THE LOGAN ACT When in a Philadelphia Quaker named Logan went to Paris on his own to undertake a negotiation with the French Government with a view to averting war between France and the United States his enterprise stimulated Congress to pass An Act to Prevent Usurpation of Executive Functions, which, more honored in the breach than the observance, still survives on the statute books.	0
93	COMMERCE TODAY Later in his opinion Marshall qualified the word intercourse with the word commercial.	0
1560	With respect to the cocoons spun by the different larv?ª, both workers and drones spin complete cocoons, or inclose themselves on every side; royal larv?ª construct only imperfect cocoons, open behind, and enveloping only the head, thorax, and first ring of the abdomen; and Huber concludes, without any hesitation, that the final cause of their forming only incomplete cocoons is, that they may thus be exposed to the mortal sting of the first hatched queen, whose instinct leads her instantly to seek the destruction of those who would soon become her rivals.	1
378	As I busied myself making notes, what should come flying up the valley but the owl himself back to the very place of the crime, intent on completing his meal no doubt.	1
135	Man's Best Friend A statute providing that no dog shall be entitled to the protection of the law unless placed upon the assessment rolls, and that in a civil action for killing a dog the owner cannot recover beyond the value fixed by himself in the last assessment preceding the killing is within the police power of the State.	0
451	By the use of my hives, the bee keeper can easily multiply very rapidly, the number of his colonies, as soon as he finds, not merely that money can be made by keeping bees, but that he can make it.	1
46	By close divisions, it also sustained the right of a State to forbid the conscription of neutrals by the picketing of a restaurant solely because the owner had contracted for the erection of a building not connected with the restaurant and located some distance away by a contractor who employed nonunion men; or the picketing of a shop operated by the owner without employees to induce him to observe certain closing hours.	0
1134	That is the simple white spot meaning, Here is the trail. The Indian in making it may nick off an infinitesimal speck of bark with his knife, the trapper with his hatchet may make it as big as a dollar, or the settler with his heavy axe may stab off half the tree side; but the sign is the same in principle and in meaning, on trunk, log, or branch from Atlantic to Pacific and from Hudson Strait to Rio Grande.	1
1421	These are the inscriptions that every hunter must learn to read infallibly, and be they strong or faint, straight or crooked, simple or overwritten with many a puzzling, diverse phrase, he must decipher and follow them swiftly, unerringly if there is to be a successful ending to the hunt which provides his daily food.	1
584	Huber, in one of his experiments, found twenty four in one hive, and even a larger number has sometimes been reared by a single colony.	0
293	A scout should remember not to expose himself too much to the sun nor should he wear too heavy clothing in the summer.	1
83	It is very true that in modern times many of the effects of either relation master and servant or principal and agent may be accounted for as the result of acts done by the master himself.	1
99	But in the absence of specific legislative provision to the contrary, the President may remove at his discretion an inferior officer whose term is limited by statute, or one appointed with the consent of the Senate.	0
1294	The patient should be watched carefully for an hour or two even after he is considered out of danger.	1
284	A President of the Union, on the other hand, though he may even pardon treason, when prosecuted in the ordinary course of law, could shelter no offender, in any degree, from the effects of impeachment and conviction.	1
454	Certain well defined duties to perform for her Patrol.	1
278	A master has maintained trespass against a servant for converting cloth which he was employed to sell, and the American cases go the full length of the old doctrine.	0
1212	The Fireless Cooker When a Girl Scout gets to thinking about all the work to be done in a kitchen she will ask some very important questions.	0
1488	To this reasoning it has been objected that the President, by the influence of the power of nomination, may secure the complaisance of the Senate to his views.	0
230	See also Justice White's dissenting opinion, for himself, Chief Justice Fuller, and Justices Peckham and Holmes, in Northern Securities Co. v. United States, U.S. .	0
697	If the student wishes to do so, he may invent a dozen similar feats, just as sensational and just as effective.	1
160	Nor did it make any difference that the solicitor received his compensation in form of down payment by the purchaser.	1
1221	THE GIRL SCOUT COOK BY ULA M. DOW, A. M. In charge of Division of Food, Simmons College The Girl Scout who has earned the Cooking Badge may be a great help at home if she has learned to work quickly and neatly and may get much amusement both at home and on camping parties.	0
472	Demonstrate ability to observe quickly and accurately by describing the contents of a room or a shop window, or a table with a number of objects upon it, after looking a short time, not more than ten seconds ; or describe a passer by so that another person could identify him; or prove ability to make a quick rough report on the appearance and landmarks of a stretch of country, not to exceed one quarter of a mile and to be covered in not more than five minutes.	1
302	A stimulant may be given when the patient is so far recovered that he is able to swallow.	0
931	Likewise in United States v. Ferreira the Court sustained the act conferring powers on the Florida territorial court to examine claims arising under the Spanish treaty and to report his decisions and the evidence on which they were based to the Secretary of the Treasury for subsequent action.	0
609	If a man forcibly resists an officer lawfully making an arrest, and kills him, knowing him to be an officer, it may be murder, although no act is done which, but for his official function, would be criminal at all.	0
749	In either supposition, it is certainly desirable that the Executive should be in a situation to dare to act his own opinion with vigor and decision.	0
644	If it should be suggested that what has been said goes to show that the first grantor's duty to warrant arose from the assign's becoming his man and owing homage, the answer is that he was not bound unless he had mentioned assigns in his grant, homage or no homage.	0
74	Justice Frankfurter presented a concurring opinion for himself and Justices Jackson, Rutledge and Burton.	0
1165	The case turned upon a question which was debated for centuries before it was settled, whether debt would lie for a sum of money promised by the defendant to the plaintiff if he would marry the defendant's daughter.	0
934	Lincoln's emancipation of the slaves was made only after he had convinced himself it could not be longer deferred and preserve the Union.	0
208	In a concurring opinion concerning the scope of the protection afforded by this clause of the Fourteenth Amendment, Justice Frankfurter contended that further argument thereon is foreclosed by Twining v. New Jersey, a precedent, on which he commented as follows: Decisions of this Court do not have equal intrinsic authority.	0
337	Although compulsory processes of justice may be used to call the accused as a witness and to require him to testify, compulsion by torture to extort a confession is a different matter.	1
1315	The President does not enlist in, and he is not inducted or drafted into the armed forces.	0
1259	The license was withheld on the premise that a conscientious belief in nonviolence to the extent that the believer would not use force to prevent wrong, no matter how aggravated, made it impossible for him to swear in good faith to support the State Constitution.	1
1499	We are taking it for granted that the student will wish to act as a Receiver or Performer of the feat of Mind Reading rather than as the Transmitter or person called upon to have his mind read .	0
1199	The draw sheet is so called because its proper use is to be drawn through under the patient without greatly disturbing her and give her a cool fresh place to lie on.	1
815	Individuality If the foregoing qualities enter into a scout's training, an individuality will be developed in him, which will make itself known and felt.	1
827	It follows from the Kantian doctrine, that a man in possession is to be confirmed and maintained in it until he is put out by an action brought for the purpose.	1
342	Always let a patient try it herself with her hand and arm before getting in.	1
1324	The President's power to enter into agreements or compacts with other governments without consulting the Senate must be referred to his powers as organ of foreign relations and as Commander in Chief.	0
1067	Rights to which B as B could show no title, he could readily maintain under the fiction that he was the same person as A, whose title was not denied.	0
1538	When the other scout reaches him, he finds the injured scout lying flat on the ground with both legs stretched out.	0
18	However, a conviction before a mayor's court does not become constitutionally defective by reason of the fact that the fixed salary of the mayor is paid out of the fund to which the fines imposed by him contribute.	1
810	In Williams v. New York, the Supreme Court rejected the contention that the due process clause requires that a person convicted of murder be permitted to cross examine probation officers as to his prior criminal record when the trial judge, in the exercise of discretion vested in him by law, considers such information, obtained outside the courtroom, in determining whether to abide by a jury's recommendation of life imprisonment or to impose a death sentence.	0
158	If an accused takes the stand in his own behalf, he must submit to cross examination; while if he does not, it is by no means certain that the trial judge in a federal court may not, without violation of the clause, draw the jury's attention to the fact.	1
539	Have secured at least two tenants in bird boxes erected by himself.	1
1014	On the other hand, there can be no case in which the law maker makes certain conduct criminal without his thereby showing a wish and purpose to prevent that conduct.	1
